{
  "$schema": "https://json-schema.org/draft/2020-12/schema",
  "$id": "https://example.com/dsl-flow.schema.json",
  "title": "Anonymized Multi-Turn Conversation Flow (BSP Architecture)",
  "description": "Defines a directed graph of Bulk Synchronous Parallel supersteps for orchestration of multiple LLM agents.",
  "type": "object",
  "required": ["flow_id", "supersteps"],
  "properties": {
    "flow_id": {
      "type": "string",
      "description": "Unique identifier for this conversation topology."
    },
    "global_timeout_ms": {
      "type": "integer",
      "default": 60000,
      "description": "Hard cutoff for the entire execution to prevent hung processes."
    },
    "models": {
      "type": "array",
      "description": "Global list of models available for this workflow. Referenced by perspective_matrix or individual workers.",
      "items": { "type": "string" }
    },
    "scope_alignment": {
      "type": "object",
      "description": "Optional: Enable scope alignment to prevent role drift by refining worker responsibilities before execution.",
      "properties": {
        "enabled": {
          "type": "boolean",
          "default": false,
          "description": "Enable scope alignment pre-processing"
        },
        "coordinator_model": {
          "type": "string",
          "default": "openai/gpt-4o",
          "description": "Model to use for meta-coordination (Phase 2)"
        },
        "scope_construction_timeout_ms": {
          "type": "integer",
          "default": 30000,
          "description": "Timeout for Phase 1 scope construction per worker"
        },
        "alignment_timeout_ms": {
          "type": "integer",
          "default": 30000,
          "description": "Timeout for Phase 2 scope alignment"
        }
      }
    },
    "variables": {
      "type": "array",
      "description": "The 'Memory' of the flow. These are the keys that can be read/written by Reducers.",
      "items": {
        "type": "object",
        "required": ["name", "type"],
        "properties": {
          "name": { "type": "string" },
          "type": { "type": "string", "enum": ["string", "json_object", "list"] },
          "default_value": { "type": ["string", "object", "array", "null"] }
        }
      }
    },
    "supersteps": {
      "type": "array",
      "description": "The sequence of synchronized steps. Each step MUST complete before the next begins.",
      "items": { "$ref": "#/definitions/Superstep" }
    }
  },
  "definitions": {
    "Superstep": {
      "oneOf": [
        { "$ref": "#/definitions/MapReduceSuperstep" },
        { "$ref": "#/definitions/ScoreAndRankSuperstep" }
      ]
    },
    "MapReduceSuperstep": {
      "type": "object",
      "required": ["step_id", "map_phase", "reduce_phase"],
      "properties": {
        "superstep_type": {
          "type": "string",
          "const": "map_reduce",
          "description": "Type of superstep (default: map_reduce)"
        },
        "step_id": {
          "type": "string",
          "description": "Unique ID for logging and transitioning."
        },
        "description": {
          "type": "string",
          "description": "Human-readable intent (e.g., 'Gather initial perspectives')."
        },

        "// PHASE 1": { "description": "---------------- MAP ----------------" },
        "map_phase": {
          "type": "object",
          "required": ["perspectives"],
          "properties": {
            "concurrency_limit": {
              "type": "integer",
              "description": "Max parallel goroutines allowed."
            },
            "global_instruction_overlay": {
              "type": "string",
              "description": "Instruction appended to ALL workers in this step (e.g., 'Be concise')."
            },
            "perspectives": {
              "type": "array",
              "description": "Model-neutral instructions (DEFAULT). Each perspective is analyzed by all models unless model_ref is specified for a specific model binding.",
              "items": {
                "type": "object",
                "required": ["perspective_id", "instruction"],
                "properties": {
                  "perspective_id": {
                    "type": "string",
                    "description": "Unique identifier for this perspective (e.g., 'security_analysis', 'optimist')"
                  },
                  "instruction": {
                    "type": "string",
                    "description": "What to analyze/predict from this perspective"
                  },
                  "model_ref": {
                    "type": "string",
                    "description": "OPTIONAL: Bind this perspective to a specific model (special case opt-out from model-neutral default). Example: 'openai/gpt-4'"
                  }
                }
              }
            }
          }
        },

        "// PHASE 2": { "description": "---------------- MIDDLEWARE ----------------" },
        "middleware_phase": {
          "type": "array",
          "description": "Pipeline of operations applied to worker outputs before the Reducer sees them.",
          "items": {
            "type": "object",
            "required": ["op", "apply_to"],
            "properties": {
              "apply_to": {
                "type": "array",
                "items": { "type": "string" },
                "description": "List of worker_ids to apply this to, or ['*'] for all."
              },
              "op": {
                "type": "string",
                "enum": ["filter_regex", "anonymize_pii", "llm_refine", "truncate"]
              },
              "config": {
                "type": "object",
                "description": "Polymorphic configuration based on 'op'."
}
            },
            "allOf": [
              {
                "if": { "properties": { "op": { "const": "filter_regex" } } },
                "then": {
                  "properties": {
                    "config": {
                      "required": ["pattern", "action"],
                      "properties": {
                        "pattern": { "type": "string", "format": "regex" },
                        "action": { "type": "string", "enum": ["drop", "flag"] }
                      }
                    }
                  }
                }
              },
              {
                "if": { "properties": { "op": { "const": "llm_refine" } } },
                "then": {
                  "properties": {
                    "config": {
                      "required": ["model_ref", "instruction"],
                      "properties": {
                        "model_ref": { "type": "string" },
                        "instruction": { "type": "string", "description": "e.g., 'Make tone neutral'" }
                      }
                    }
                  }
                }
              }
            ]
          }
        },

        "// PHASE 3": { "description": "---------------- REDUCE (BARRIER) ----------------" },
        "reduce_phase": {
          "type": "object",
          "required": ["strategy", "model_ref", "output_write_to", "visibility"],
          "properties": {
            "model_ref": { "type": "string" },
            "timeout_ms": { "type": "integer", "default": 30000 },
            "output_write_to": { 
              "type": "string", 
              "description": "Name of the variable to update with the result." 
            },
            "strategy": {
              "type": "string",
              "enum": ["council_chairman", "simple_summary", "vote_majority", "subquery_single_model", "cross_interrogation", "column_wise_summary", "score_and_rank"],
              "description": "Reduction strategy. 'column_wise_summary' groups worker outputs by perspective and creates per-perspective summaries. 'score_and_rank' performs anonymous peer review and ranking."
            },
            "variable_interpolation": {
              "type": "boolean",
              "description": "Enable ${variable_name} interpolation in chairman_instructions and global_instruction_overlay.",
              "default": false
            },
            "visibility": {
              "type": "object",
              "description": "Strict controls on what the Reducer is allowed to see.",
              "properties": {
                "include_original_input": { "type": "boolean" },
                "mask_worker_identities": {
                  "type": "boolean",
                  "description": "If true, 'Legal Bot' becomes 'Argument 1' (Blind Review)."
                },
                "include_rejected_items": {
                  "type": "boolean",
                  "description": "Should the chairman see items dropped by middleware?"
                },
                "include_conversation_history": {
                  "type": "boolean",
                  "description": "If false, only sends current query without any prior context (clean subquery)."
                },
                "include_worker_outputs": {
                  "type": "boolean",
                  "description": "If false, reducer ignores worker outputs (for single-model subqueries)."
                }
              }
            },
            "chairman_instructions": {
              "type": "string",
              "description": "Specific logic for the decision maker (e.g., 'Side with security if risk > low')."
            },
            "ranking_instructions": {
              "type": "string",
              "description": "Custom criteria for evaluating responses (used by score_and_rank strategy)."
            },
            "evaluator_models": {
              "type": "array",
              "items": { "type": "string" },
              "description": "Models to use as evaluators for score_and_rank strategy (defaults to [model_ref])."
            },
            "ranking_algorithm": {
              "type": "string",
              "enum": ["average_position", "borda_count", "ranked_pairs", "schulze"],
              "default": "average_position",
              "description": "Algorithm to use for score_and_rank strategy."
            },
            "output_format": {
              "type": "string",
              "enum": ["full", "aggregate_only", "rankings_only"],
              "default": "full",
              "description": "Output format for score_and_rank strategy."
            },
            "require_complete_rankings": {
              "type": "boolean",
              "default": false,
              "description": "If true, reject evaluations that don't rank all responses (score_and_rank only)."
            }
          }
        }
      }
    },
    "ScoreAndRankSuperstep": {
      "type": "object",
      "description": "Special superstep type for anonymous peer review and ranking. Multiple evaluator models receive full conversation history and rank previous outputs. Rankings are aggregated algorithmically (not by LLM).",
      "required": ["superstep_type", "step_id", "evaluator_models", "output_write_to"],
      "properties": {
        "superstep_type": {
          "type": "string",
          "const": "score_and_rank",
          "description": "Identifies this as a score_and_rank superstep"
        },
        "step_id": {
          "type": "string",
          "description": "Unique ID for logging and transitioning"
        },
        "description": {
          "type": "string",
          "description": "Human-readable intent (e.g., 'Peer review of initial analyses')"
        },
        "evaluator_models": {
          "type": "array",
          "items": { "type": "string" },
          "minItems": 1,
          "description": "Models that will judge and rank previous outputs. These models work in parallel, not sequentially."
        },
        "ranking_instructions": {
          "type": "string",
          "default": "Rank responses by quality, accuracy, and usefulness.",
          "description": "Custom evaluation criteria for the evaluators"
        },
        "visibility": {
          "type": "object",
          "description": "Controls what conversation history evaluators see",
          "properties": {
            "include_original_input": {
              "type": "boolean",
              "default": true,
              "description": "Include the original user query"
            },
            "include_conversation_history": {
              "type": "boolean",
              "default": true,
              "description": "Include full conversation from previous supersteps"
            },
            "mask_worker_identities": {
              "type": "boolean",
              "default": true,
              "description": "Anonymize worker IDs to 'Response A', 'Response B', etc."
            },
            "include_supersteps": {
              "oneOf": [
                {
                  "type": "array",
                  "items": { "type": "integer" },
                  "description": "Specific superstep indices to include (e.g., [0, 1, 2])"
                },
                {
                  "type": "array",
                  "items": { "enum": ["all", "latest"] },
                  "maxItems": 1,
                  "description": "'all' for all previous supersteps, 'latest' for only the immediately previous superstep"
                }
              ],
              "default": ["all"],
              "description": "Which supersteps to include in conversation history"
            }
          }
        },
        "ranking_algorithm": {
          "type": "string",
          "enum": ["average_position", "borda_count", "ranked_pairs", "schulze"],
          "default": "average_position",
          "description": "Algorithm for aggregating rankings: average_position (simple average), borda_count (positional scoring), ranked_pairs (Tideman), schulze (beatpath)"
        },
        "output_write_to": {
          "type": "string",
          "description": "Variable name to write the ranking results"
        },
        "output_format": {
          "type": "string",
          "enum": ["leaderboard", "full", "rankings_only"],
          "default": "leaderboard",
          "description": "Format of output: leaderboard (street ranking card), full (complete evaluation data), rankings_only (sorted worker IDs)"
        },
        "require_complete_rankings": {
          "type": "boolean",
          "default": false,
          "description": "If true, reject evaluations that don't rank all responses"
        }
      }
    }
  }
}