{
  "flow_id": "cross_interrogation_demo",
  "global_timeout_ms": 300000,
  "variables": [
    {
      "name": "stage1_responses",
      "type": "string",
      "description": "Initial responses from all models"
    },
    {
      "name": "stage1_5_questions",
      "type": "string",
      "description": "Cross-interrogation questions (JSON)"
    },
    {
      "name": "stage1_5_answers",
      "type": "string",
      "description": "Answers to cross-interrogation questions"
    },
    {
      "name": "final_synthesis",
      "type": "string",
      "description": "Chairman's final synthesis"
    }
  ],
  "supersteps": [
    {
      "step_id": "stage1",
      "description": "Gather initial perspectives from council members",
      "map_phase": {
        "concurrency_limit": 3,
        "perspectives": [
          {
            "perspective_id": "worker_a",
            "instruction": "Provide a comprehensive, well-reasoned answer. Analyze all relevant aspects thoroughly and structure your response clearly.",
            "model_ref": "openai/gpt-5.1"
          },
          {
            "perspective_id": "worker_b",
            "instruction": "Provide a balanced, nuanced response that considers multiple perspectives. Identify trade-offs and acknowledge different viewpoints.",
            "model_ref": "google/gemini-3-pro-preview"
          },
          {
            "perspective_id": "worker_c",
            "instruction": "Provide a clear, structured, and accurate answer. Focus on precision and logical organization of information.",
            "model_ref": "moonshotai/kimi-k2-thinking"
          }
        ]
      },
      "reduce_phase": {
        "strategy": "simple_summary",
        "model_ref": "google/gemini-3-pro-preview",
        "output_write_to": "stage1_responses",
        "visibility": {
          "include_original_input": true,
          "mask_worker_identities": false,
          "include_rejected_items": false,
          "include_conversation_history": true,
          "include_worker_outputs": true
        }
      }
    },
    {
      "step_id": "stage1_5_questions",
      "description": "Generate cross-interrogation questions about other responses",
      "map_phase": {
        "concurrency_limit": 3,
        "global_instruction_overlay": "Here are the responses from different models:\n\n${stage1_responses}\n\nGenerate 1-2 focused follow-up questions for OTHER responses (not your own). Format as:\nQUESTIONS FOR Response [X]:\n1. [Your first question]\n2. [Your second question]",
        "perspectives": [
          {
            "perspective_id": "worker_a",
            "instruction": "Review the responses and generate clarifying questions. Probe deeper into assumptions, explore edge cases, or clarify ambiguities you identify.",
            "model_ref": "openai/gpt-5.1"
          },
          {
            "perspective_id": "worker_b",
            "instruction": "Review the responses and generate clarifying questions. Probe deeper into assumptions, explore edge cases, or clarify ambiguities you identify.",
            "model_ref": "x-ai/grok-4"
          },
          {
            "perspective_id": "worker_c",
            "instruction": "Review the responses and generate clarifying questions. Probe deeper into assumptions, explore edge cases, or clarify ambiguities you identify.",
            "model_ref": "anthropic/claude-sonnet-4.5"
          }
        ]
      },
      "reduce_phase": {
        "strategy": "cross_interrogation",
        "model_ref": "google/gemini-3-pro-preview",
        "output_write_to": "stage1_5_questions",
        "variable_interpolation": true,
        "visibility": {
          "include_original_input": false,
          "mask_worker_identities": false,
          "include_rejected_items": false,
          "include_conversation_history": true,
          "include_worker_outputs": true
        }
      }
    },
    {
      "step_id": "stage1_5_answers",
      "description": "Collect answers to cross-interrogation questions",
      "map_phase": {
        "concurrency_limit": 3,
        "global_instruction_overlay": "Questions directed at you:\n\n${stage1_5_questions}\n\nPlease answer each question concisely. Defend your reasoning, elaborate where necessary, or acknowledge any overlooked aspects. Keep each answer brief (1-3 sentences).",
        "perspectives": [
          {
            "perspective_id": "worker_a",
            "instruction": "Answer the questions directed at your original response. Be clear and concise in your answers.",
            "model_ref": "openai/gpt-5.1"
          },
          {
            "perspective_id": "worker_b",
            "instruction": "Answer the questions directed at your original response. Be clear and concise in your answers.",
            "model_ref": "google/gemini-3-pro-preview"
          },
          {
            "perspective_id": "worker_c",
            "instruction": "Answer the questions directed at your original response. Be clear and concise in your answers.",
            "model_ref": "moonshotai/kimi-k2-thinking"
          }
        ]
      },
      "reduce_phase": {
        "strategy": "simple_summary",
        "model_ref": "google/gemini-3-pro-preview",
        "output_write_to": "stage1_5_answers",
        "variable_interpolation": true,
        "visibility": {
          "include_original_input": false,
          "mask_worker_identities": false,
          "include_rejected_items": false,
          "include_conversation_history": true,
          "include_worker_outputs": true
        }
      }
    },
    {
      "step_id": "final_synthesis",
      "description": "Chairman synthesizes all perspectives including Q&A",
      "map_phase": {
        "perspectives": [
          {
            "perspective_id": "chairman",
            "instruction": "Synthesize all information into a comprehensive final answer. Integrate insights from initial responses and the Q&A discussion.",
            "model_ref": "google/gemini-3-pro-preview"
          }
        ]
      },
      "reduce_phase": {
        "strategy": "council_chairman",
        "model_ref": "google/gemini-3-pro-preview",
        "output_write_to": "final_synthesis",
        "variable_interpolation": true,
        "visibility": {
          "include_original_input": true,
          "mask_worker_identities": false,
          "include_rejected_items": false,
          "include_conversation_history": true,
          "include_worker_outputs": true
        },
        "chairman_instructions": "You have access to:\n\n1. Initial Responses:\n${stage1_responses}\n\n2. Cross-Interrogation Q&A:\nQuestions: ${stage1_5_questions}\nAnswers: ${stage1_5_answers}\n\nSynthesize all of this into a comprehensive, accurate answer. Consider the initial responses, the probing questions that revealed deeper insights, and the clarifying answers. Provide a clear, well-reasoned final answer that represents the council's collective wisdom."
      }
    }
  ],
  "models": [
    "openai/gpt-5.1",
    "anthropic/claude-sonnet-4.5",
    "google/gemini-3-pro-preview",
    "x-ai/grok-4",
    "moonshotai/kimi-k2-thinking"
  ]
}