{
  "flow_id": "simple_debate",
  "global_timeout_ms": 120000,
  "variables": [
    {
      "name": "final_answer",
      "type": "string"
    }
  ],
  "supersteps": [
    {
      "step_id": "debate",
      "description": "Two perspectives, one synthesis",
      "map_phase": {
        "perspectives": [
          {
            "perspective_id": "optimist",
            "instruction": "Analyze this from an optimistic perspective. Predict what an optimistic thinker would identify as the key benefits, opportunities, and positive aspects. Focus on the upside potential.",
            "model_ref": "openai/gpt-4"
          },
          {
            "perspective_id": "skeptic",
            "instruction": "Analyze this from a skeptical perspective. Predict what a critical thinker would identify as the key risks, challenges, and potential problems. Focus on identifying vulnerabilities.",
            "model_ref": "anthropic/claude-3.5-sonnet"
          }
        ]
      },
      "reduce_phase": {
        "strategy": "council_chairman",
        "model_ref": "google/gemini-2.0-flash-exp",
        "output_write_to": "final_answer",
        "visibility": {
          "include_original_input": true,
          "mask_worker_identities": false,
          "include_rejected_items": false,
          "include_conversation_history": true,
          "include_worker_outputs": true
        },
        "chairman_instructions": "Balance both the optimistic and skeptical perspectives into a nuanced, well-reasoned answer that acknowledges both benefits and risks."
      }
    }
  ]
}